{
  "version": 1,
  "name": "Light",
  "description": "Default light commerce theme.",
  "tokens": {
    "color": {
      "background": "#ffffff",
      "surface": "#f8fafc",
      "text": "#111827",
      "textMuted": "#6b7280",
      "accent": "#2563eb",
      "border": "#e5e7eb"
    },
    "space": {
      "xs": "4px",
      "sm": "8px",
      "md": "16px",
      "lg": "24px"
    },
    "radius": {
      "sm": "4px",
      "md": "8px",
      "lg": "16px"
    }
  }
}
